Missed oportunities,2,-0.427935,negative
I don't like myself to the point where I don't feel much anymore.,3,-0.652972,negative
Anyone else have this kind of depression?,1,-0.315541,negative
Which came first - depression or unhappy marriage?,1,-0.370622,negative
I need to talk to somebody,3,-0.415887,negative
being lonely fucking sucks,6,-0.823002,negative
Desperate,3,-0.553047,negative
I'm scared,6,-0.401777,negative
The death of my dog is pushing me over the edge and I cannot handle it.,7,-0.313711,negative
Everyday,1,-0.52049,negative
Have got to calm down,1,-0.454757,negative
"Sick because I'm depressed, depressed because I'm sick",1,-0.640685,negative
"I have atypical, treatment-resistant depression.",2,-0.428021,negative
All I want is a hug,1,-0.498742,negative
Treatment centers good or bad?,1,-0.503425,negative
Somebody help me.,1,-0.696337,negative
I would kill for some real life friends.,16,0.311418,positive
I just had to killed half my rabbit herd in a day through my own incompetence. I feel in over my head at school. I feel alone in life.,1,-0.4528,negative
"Is there any validity at all to ""living in the moment"" or is it 100% just a mindless platitude?",4,-0.64153,negative
Really need help - Is it possible to pull yourself through without the aid of a therapist?,2,-0.0844543,negative
Nobody understands,3,-0.718113,negative
Words aren't enough anymore.,1,-0.715649,negative
"Fiance ends engagement, no longer driven to do anything",1,-0.514244,negative
Just had a dream about love.,1,-0.400508,negative
I silently suffer because I have nothing to complain about,7,-0.854533,negative
"I hate myself, I can never do anything right, and I'm very pessimistic",1,-0.724288,negative
"Want to try to get in shape again, but I can barely get myself to do anything (a bit long)",1,-0.472539,negative
"I feel alone, scared and anxious",4,-0.606803,negative
What to expect for a doctor's appointment?,2,-0.0756315,negative
Girlfriend dealing with depression,1,-0.542904,negative
Think I might be slipping back into depression,1,-0.669595,negative
I need help,1,-0.585933,negative
Question about getting Medicine,3,-0.600403,negative
Acne,1,-0.341244,negative
I'm tired.,2,-0.323437,negative
Wellbutrin increasing depression,2,-0.193974,negative
Is it common to feel like shit because how your depression affects others?,1,-0.787035,negative
Before you go to sleep,13,-0.680884,negative
My Second Attempt.,2,-0.261476,negative
I've given up on myself and I don't want to,2,-0.555112,negative
My wife says she has the impulse to hurt herself,2,-0.427902,negative
"Traumatized from an in-patient admission, not sure what to do now...",3,-0.495036,negative
Untitled,2,-0.366024,negative
Sometimes I feel like I'm going crazy.,3,-0.378915,negative
At which point a depression really is a depression?,1,-0.258004,negative
What a waste of space and life and time I am,45,-0.580455,negative
When does it start to get better?,1,-0.552465,negative
(TW: self harm; anxiety) I want to hurt myself but I don't know why.,2,-0.343292,negative
I'm normally a very social person.,2,-0.474432,negative
Where can I find a good online help chat?,2,-0.806076,negative
Do you ever get that feeling where you no longer want to be here?,1,-0.459904,negative
I Simply Don't See a Future for Myself,35,-0.377375,negative
Brain damage from severe depression? Any hope for getting rid of residual symptoms?,2,-0.563062,negative
Does anyone have trouble balancing between deep depression and emotional numbness?,4,-0.521627,negative
Here because I am depressed; to everyone else- I love you.,206,-0.827282,negative
Someone can tell me if I have Depression or not?,0,-0.132165,negative
I'm so done..,1,-0.624604,negative
I can't even cry anymore,1,-0.508859,negative
I finally moved out of my mother's basement. Terrified of everything,3,-0.520287,negative
The world will be better off without me,3,-0.524998,negative
How do I tell my GF about my suicidal thoughts?,2,-0.722867,negative
Depressive Episodes of the vulnerability of life,2,-0.447659,negative
I don't know whether to see a doctor or not.,7,-0.584725,negative
"Having trouble taking care of gf, it's sometimes too much",4,-0.427168,negative
My girlfriend is away on vacation and I'm really worried for her,3,-0.429487,negative
My physique destroys me,1,-0.648867,negative
Can't fight it anymore,2,-0.471217,negative
The joys of antidepressants.,1,-0.555731,negative
Anyone else feel like they are being ripped off for this part of their life?,14,-0.253474,negative
What do you do when you want to kill yourself?,15,-0.619504,negative
SO has depression. I have super human levels of empathy now I'm feeling depressed.,1,-0.323789,negative
I can't sleep and it's fucking up my life,9,-0.452034,negative
No one will read this but I wish I had killed myself four years ago,3,-0.622432,negative
"New here, thinking about starting medication.",0,-0.584698,negative
Sometimes I feel like a ghost.,1,-0.3586,negative
Public Speaking. Can anyone relate?,2,-0.55412,negative
Life fucking sucks. I'm such a fucking loser.,3,-0.606357,negative
My best friend committed suicide,3,-0.718889,negative
5 bad events,1,-0.708444,negative
I don't want to be an adult.,1,-0.577721,negative
Do you have to be lonely to be depressed?,1,-0.357931,negative
Losing the motivation to carry on with any life prospects.,2,-0.671832,negative
I'm a scumbag and I don't deserve to live.,4,-0.43765,negative
I think I need help but I don't know how or where to get it,2,-0.761904,negative
My first overdose,0,0.151937,positive
I just want you to know...,10,-0.432085,negative
They're right.,3,-0.494501,negative
Poem I wrote about my depression and anxiety,16,-0.404206,negative
Hope is killing me....,3,-0.580475,negative
"Dear Effexor, f**k you.",62,-0.480175,negative
Good dreams always bum me out,42,-0.610587,negative
Have you tried this combo?,1,-0.35717,negative
Just need somewhere to vent,2,-0.660307,negative
i suck at everything,4,-0.552531,negative
Helping people feels just as boring and pointless as everything else.,11,-0.68805,negative
Has anyone here benefited from CBT?,2,0.336376,positive
What does loneliness feel like exactly?,4,-0.803166,negative
I had a dream last night,4,0.0276011,positive
how to deal with harsh words?,2,-0.54984,negative
Does anyone else ever feel like they're not depressed enough to be depressed?,87,-0.716743,negative
Shyness + Loneliness,7,-0.614913,negative
"I'm always depressed, but not always sad. Am I weird? Can someone relate?",21,-0.730924,negative
Anybody with depression have difficulty spending money on themselves?,114,-0.363738,negative
Help me out reddit,3,-0.346173,negative
What should i do to feel less lonely when I'm home alone..,3,-0.421827,negative
